    1 0.000000000 192.168.108.128 → 185.199.109.154 TLSv1.2 95 Application Data
    2 0.000144604 192.168.108.128 → 140.82.121.5 TLSv1.2 95 Application Data
    3 0.000356676 192.168.108.128 → 185.199.109.154 TLSv1.2 80 Application Data
    4 0.000405649 192.168.108.128 → 185.199.109.154 TCP 56 41964 → 443 [FIN, ACK] Seq=64 Ack=1 Win=65535 Len=0
    5 0.000495709 185.199.109.154 → 192.168.108.128 TCP 62 443 → 41964 [ACK] Seq=1 Ack=40 Win=64240 Len=0
    6 0.000524734 140.82.121.5 → 192.168.108.128 TCP 62 443 → 51702 [ACK] Seq=1 Ack=40 Win=64240 Len=0
    7 0.000661092 185.199.109.154 → 192.168.108.128 TCP 62 443 → 41964 [ACK] Seq=1 Ack=64 Win=64240 Len=0
    8 0.000868135 192.168.108.128 → 140.82.121.5 TLSv1.2 80 Application Data
    9 0.000949338 192.168.108.128 → 140.82.121.5 TCP 56 51702 → 443 [FIN, ACK] Seq=64 Ack=1 Win=62780 Len=0
   10 0.001052184 185.199.109.154 → 192.168.108.128 TCP 62 443 → 41964 [ACK] Seq=1 Ack=65 Win=64239 Len=0
   11 0.001052374 140.82.121.5 → 192.168.108.128 TCP 62 443 → 51702 [ACK] Seq=1 Ack=64 Win=64240 Len=0
   12 0.001263094 140.82.121.5 → 192.168.108.128 TCP 62 443 → 51702 [ACK] Seq=1 Ack=65 Win=64239 Len=0
   13 0.003770873 192.168.108.128 → 192.168.108.2 DNS 72 Standard query 0x8807 A github.com
   14 0.063322241 192.168.108.2 → 192.168.108.128 DNS 88 Standard query response 0x8807 A github.com A 140.82.121.3
   15 0.063519695 192.168.108.128 → 192.168.108.2 DNS 72 Standard query 0x7f18 AAAA github.com
   16 0.067220094 192.168.108.2 → 192.168.108.128 DNS 72 Standard query response 0x7f18 AAAA github.com
   17 0.068085224 192.168.108.128 → 140.82.121.3 TCP 76 38482 → 443 [SYN] Seq=0 Win=64240 Len=0 MSS=1460 SACK_PERM TSval=3633782229 TSecr=0 WS=128
   18 0.102892683 140.82.121.5 → 192.168.108.128 TCP 62 443 → 51702 [FIN, PSH, ACK] Seq=1 Ack=65 Win=64239 Len=0
   19 0.102937227 192.168.108.128 → 140.82.121.5 TCP 56 51702 → 443 [ACK] Seq=65 Ack=2 Win=62780 Len=0
   20 0.108160521 185.199.109.154 → 192.168.108.128 TLSv1.2 80 Application Data
   21 0.108212138 192.168.108.128 → 185.199.109.154 TCP 56 41964 → 443 [RST] Seq=65 Win=0 Len=0
   22 0.176976187 140.82.121.3 → 192.168.108.128 TCP 62 443 → 38482 [SYN, ACK] Seq=0 Ack=1 Win=64240 Len=0 MSS=1460
   23 0.177028586 192.168.108.128 → 140.82.121.3 TCP 56 38482 → 443 [ACK] Seq=1 Ack=1 Win=64240 Len=0
   24 0.179469370 192.168.108.128 → 140.82.121.3 TLSv1.2 573 Client Hello (SNI=github.com)
   25 0.179820805 140.82.121.3 → 192.168.108.128 TCP 62 443 → 38482 [ACK] Seq=1 Ack=518 Win=64240 Len=0
   26 0.485559466 140.82.121.3 → 192.168.108.128 TLSv1.3 2656 Server Hello, Change Cipher Spec, Application Data
   27 0.485559937 140.82.121.3 → 192.168.108.128 TLSv1.3 269 Application Data, Application Data, Application Data
   28 0.485586858 192.168.108.128 → 140.82.121.3 TCP 56 38482 → 443 [ACK] Seq=518 Ack=2601 Win=62780 Len=0
   29 0.485651090 192.168.108.128 → 140.82.121.3 TCP 56 38482 → 443 [ACK] Seq=518 Ack=2814 Win=62567 Len=0
   30 0.508860381 192.168.108.128 → 140.82.121.3 TLSv1.3 120 Change Cipher Spec, Application Data
   31 0.509553994 192.168.108.128 → 140.82.121.3 TLSv1.3 226 Application Data
   32 0.509611995 140.82.121.3 → 192.168.108.128 TCP 62 443 → 38482 [ACK] Seq=2814 Ack=582 Win=64240 Len=0
   33 0.509631922 192.168.108.128 → 140.82.121.3 TLSv1.3 725 Application Data
   34 0.509860956 140.82.121.3 → 192.168.108.128 TCP 62 443 → 38482 [ACK] Seq=2814 Ack=752 Win=64240 Len=0
   35 0.509861046 140.82.121.3 → 192.168.108.128 TCP 62 443 → 38482 [ACK] Seq=2814 Ack=1421 Win=64240 Len=0
   36 0.572569504 140.82.121.3 → 192.168.108.128 TLSv1.3 214 Application Data, Application Data
   37 0.572596245 192.168.108.128 → 140.82.121.3 TCP 56 38482 → 443 [ACK] Seq=1421 Ack=2972 Win=62780 Len=0
   38 0.639199480 140.82.121.3 → 192.168.108.128 TLSv1.3 114 Application Data
   39 0.639228936 192.168.108.128 → 140.82.121.3 TCP 56 38482 → 443 [ACK] Seq=1421 Ack=3030 Win=62780 Len=0
   40 0.639847628 192.168.108.128 → 140.82.121.3 TLSv1.3 87 Application Data
   41 0.640475046 140.82.121.3 → 192.168.108.128 TCP 62 443 → 38482 [ACK] Seq=3030 Ack=1452 Win=64240 Len=0
   42 0.643115066 140.82.121.3 → 192.168.108.128 TLSv1.3 1448 Application Data
   43 0.643146345 192.168.108.128 → 140.82.121.3 TCP 56 38482 → 443 [ACK] Seq=1452 Ack=4422 Win=62780 Len=0
   44 0.643442577 140.82.121.3 → 192.168.108.128 TLSv1.3 2465 Application Data, Application Data
   45 0.643452535 192.168.108.128 → 140.82.121.3 TCP 56 38482 → 443 [ACK] Seq=1452 Ack=6831 Win=62780 Len=0
   46 0.649038527 140.82.121.3 → 192.168.108.128 TLSv1.3 2333 Application Data, Application Data, Application Data
   47 0.649075056 192.168.108.128 → 140.82.121.3 TCP 56 38482 → 443 [ACK] Seq=1452 Ack=9108 Win=62780 Len=0
   48 0.794421280 140.82.121.3 → 192.168.108.128 TLSv1.3 2656 Application Data
   49 0.794484590 192.168.108.128 → 140.82.121.3 TCP 56 38482 → 443 [ACK] Seq=1452 Ack=11708 Win=62780 Len=0
   50 0.794719434 140.82.121.3 → 192.168.108.128 TLSv1.3 19556 Application Data, Application Data, Application Data, Application Data, Application Data, Application Data, Application Data, Application Data, Application Data, Application Data, Application Data, Application Data, Application Data, Application Data, Application Data, Application Data
   51 0.794750603 192.168.108.128 → 140.82.121.3 TCP 56 38482 → 443 [ACK] Seq=1452 Ack=31208 Win=49640 Len=0
   52 0.794803784 140.82.121.3 → 192.168.108.128 TLSv1.3 2656 Application Data, Application Data
   53 0.794811068 192.168.108.128 → 140.82.121.3 TCP 56 38482 → 443 [ACK] Seq=1452 Ack=33808 Win=47040 Len=0
   54 0.799566706 140.82.121.3 → 192.168.108.128 TLSv1.3 1356 Application Data
   55 0.799596612 192.168.108.128 → 140.82.121.3 TCP 56 38482 → 443 [ACK] Seq=1452 Ack=35108 Win=62780 Len=0
   56 0.826692806 192.168.108.128 → 192.168.108.2 DNS 76 Standard query 0xe973 A api.github.com
   57 0.857541748 192.168.108.2 → 192.168.108.128 DNS 92 Standard query response 0xe973 A api.github.com A 140.82.121.6
   58 0.857970509 192.168.108.128 → 140.82.121.6 TCP 76 56236 → 443 [SYN] Seq=0 Win=64240 Len=0 MSS=1460 SACK_PERM TSval=937085789 TSecr=0 WS=128
   59 0.868087503 140.82.121.3 → 192.168.108.128 TLSv1.3 3956 Application Data, Application Data, Application Data
   60 0.868087924 140.82.121.3 → 192.168.108.128 TLSv1.3 2656 Application Data, Application Data
   61 0.868120084 192.168.108.128 → 140.82.121.3 TCP 56 38482 → 443 [ACK] Seq=1452 Ack=39008 Win=61320 Len=0
   62 0.868285217 192.168.108.128 → 140.82.121.3 TCP 56 38482 → 443 [ACK] Seq=1452 Ack=41608 Win=59860 Len=0
   63 0.868581188 140.82.121.3 → 192.168.108.128 TLSv1.3 2656 Application Data
   64 0.868621534 192.168.108.128 → 140.82.121.3 TCP 56 38482 → 443 [ACK] Seq=1452 Ack=44208 Win=58400 Len=0
   65 0.868823457 140.82.121.3 → 192.168.108.128 TLSv1.3 1356 Application Data
   66 0.868857581 192.168.108.128 → 140.82.121.3 TCP 56 38482 → 443 [ACK] Seq=1452 Ack=45508 Win=62780 Len=0
   67 0.873991305 140.82.121.3 → 192.168.108.128 TLSv1.3 3956 Application Data, Application Data, Application Data
   68 0.873991736 140.82.121.3 → 192.168.108.128 TLSv1.3 1356 Application Data
   69 0.874317553 192.168.108.128 → 140.82.121.3 TCP 56 38482 → 443 [ACK] Seq=1452 Ack=50708 Win=61320 Len=0
   70 0.874538371 140.82.121.3 → 192.168.108.128 TLSv1.3 2656 Application Data, Application Data
   71 0.874568187 192.168.108.128 → 140.82.121.3 TCP 56 38482 → 443 [ACK] Seq=1452 Ack=53308 Win=58720 Len=0
   72 0.874716990 140.82.121.3 → 192.168.108.128 TLSv1.3 414 Application Data, Application Data
   73 0.874761684 192.168.108.128 → 140.82.121.3 TCP 56 38482 → 443 [ACK] Seq=1452 Ack=53666 Win=62780 Len=0
   74 0.925942067 140.82.121.6 → 192.168.108.128 TCP 62 443 → 56236 [SYN, ACK] Seq=0 Ack=1 Win=64240 Len=0 MSS=1460
   75 0.926021427 192.168.108.128 → 140.82.121.6 TCP 56 56236 → 443 [ACK] Seq=1 Ack=1 Win=64240 Len=0
   76 0.930854662 192.168.108.128 → 140.82.121.6 TLSv1.2 573 Client Hello (SNI=api.github.com)
   77 0.931430092 140.82.121.6 → 192.168.108.128 TCP 62 443 → 56236 [ACK] Seq=1 Ack=518 Win=64240 Len=0
   78 0.995482215 140.82.121.6 → 192.168.108.128 TLSv1.3 2868 Server Hello, Change Cipher Spec, Application Data, Application Data, Application Data, Application Data
   79 0.995519315 192.168.108.128 → 140.82.121.6 TCP 56 56236 → 443 [ACK] Seq=518 Ack=2813 Win=62780 Len=0
   80 1.003109261 192.168.108.128 → 140.82.121.6 TLSv1.3 120 Change Cipher Spec, Application Data
   81 1.003666466 192.168.108.128 → 140.82.121.6 TLSv1.3 226 Application Data
   82 1.003725788 192.168.108.128 → 140.82.121.6 TLSv1.3 406 Application Data
   83 1.003766696 192.168.108.128 → 140.82.121.6 TLSv1.3 242 Application Data
   84 1.003895550 140.82.121.6 → 192.168.108.128 TCP 62 443 → 56236 [ACK] Seq=2813 Ack=582 Win=64240 Len=0
   85 1.003895680 140.82.121.6 → 192.168.108.128 TCP 62 443 → 56236 [ACK] Seq=2813 Ack=752 Win=64240 Len=0
   86 1.003925586 140.82.121.6 → 192.168.108.128 TCP 62 443 → 56236 [ACK] Seq=2813 Ack=1102 Win=64240 Len=0
   87 1.003939092 140.82.121.6 → 192.168.108.128 TCP 62 443 → 56236 [ACK] Seq=2813 Ack=1288 Win=64240 Len=0
   88 1.098754495 140.82.121.6 → 192.168.108.128 TLSv1.3 214 Application Data, Application Data
   89 1.098781195 192.168.108.128 → 140.82.121.6 TCP 56 56236 → 443 [ACK] Seq=1288 Ack=2971 Win=62780 Len=0
   90 1.115688139 192.168.108.128 → 192.168.108.2 DNS 85 Standard query 0xd96f A github.githubassets.com
   91 1.201049074 140.82.121.6 → 192.168.108.128 TLSv1.3 140 Application Data
   92 1.201084241 192.168.108.128 → 140.82.121.6 TCP 56 56236 → 443 [ACK] Seq=1288 Ack=3055 Win=62780 Len=0
   93 1.201312923 192.168.108.128 → 140.82.121.6 TLSv1.3 87 Application Data
   94 1.201581231 140.82.121.6 → 192.168.108.128 TCP 62 443 → 56236 [ACK] Seq=3055 Ack=1319 Win=64240 Len=0
   95 1.203717008 192.168.108.2 → 192.168.108.128 DNS 149 Standard query response 0xd96f A github.githubassets.com A 185.199.110.154 A 185.199.109.154 A 185.199.108.154 A 185.199.111.154
   96 1.204184402 192.168.108.128 → 185.199.109.154 TCP 76 41968 → 443 [SYN] Seq=0 Win=64240 Len=0 MSS=1460 SACK_PERM TSval=926921260 TSecr=0 WS=128
   97 1.272234978 192.168.108.128 → 140.82.121.3 TLSv1.3 199 Application Data
   98 1.272615569 140.82.121.3 → 192.168.108.128 TCP 62 443 → 38482 [ACK] Seq=53666 Ack=1595 Win=64240 Len=0
   99 1.275895663 185.199.109.154 → 192.168.108.128 TCP 62 443 → 41968 [SYN, ACK] Seq=0 Ack=1 Win=64240 Len=0 MSS=1460
  100 1.275965946 192.168.108.128 → 185.199.109.154 TCP 56 41968 → 443 [ACK] Seq=1 Ack=1 Win=64240 Len=0
  101 1.279119469 192.168.108.128 → 185.199.109.154 TLSv1.2 647 Client Hello (SNI=github.githubassets.com)
  102 1.279514828 185.199.109.154 → 192.168.108.128 TCP 62 443 → 41968 [ACK] Seq=1 Ack=592 Win=64240 Len=0
  103 1.288128874 192.168.108.128 → 185.199.109.154 TCP 76 41970 → 443 [SYN] Seq=0 Win=64240 Len=0 MSS=1460 SACK_PERM TSval=926921344 TSecr=0 WS=128
  104 1.290192382 140.82.121.6 → 192.168.108.128 TLSv1.3 983 Application Data
  105 1.290226326 192.168.108.128 → 140.82.121.6 TCP 56 56236 → 443 [ACK] Seq=1319 Ack=3982 Win=62780 Len=0
  106 1.298345504 192.168.108.128 → 192.168.108.2 DNS 91 Standard query 0xdb7f A avatars.githubusercontent.com
  107 1.330678417 192.168.108.2 → 192.168.108.128 DNS 155 Standard query response 0xdb7f A avatars.githubusercontent.com A 185.199.110.133 A 185.199.111.133 A 185.199.108.133 A 185.199.109.133
  108 1.331082833 192.168.108.128 → 185.199.111.133 TCP 76 44956 → 443 [SYN] Seq=0 Win=64240 Len=0 MSS=1460 SACK_PERM TSval=2698418580 TSecr=0 WS=128
  109 1.340157933 140.82.121.3 → 192.168.108.128 TLSv1.3 2840 Application Data, Application Data
  110 1.340237142 192.168.108.128 → 140.82.121.3 TCP 56 38482 → 443 [ACK] Seq=1595 Ack=56450 Win=62780 Len=0
  111 1.345739364 140.82.121.3 → 192.168.108.128 TLSv1.3 3956 Application Data, Application Data
  112 1.345783107 192.168.108.128 → 140.82.121.3 TCP 56 38482 → 443 [ACK] Seq=1595 Ack=60350 Win=61320 Len=0
  113 1.346702789 140.82.121.3 → 192.168.108.128 TLSv1.3 8500 Application Data, Application Data, Application Data, Application Data, Application Data, Application Data
  114 1.346733157 192.168.108.128 → 140.82.121.3 TCP 56 38482 → 443 [ACK] Seq=1595 Ack=68794 Win=58400 Len=0
  115 1.347179312 140.82.121.3 → 192.168.108.128 TLSv1.3 2656 Application Data, Application Data
  116 1.347179482 140.82.121.3 → 192.168.108.128 TLSv1.3 1144 Application Data, Application Data
  117 1.347193138 192.168.108.128 → 140.82.121.3 TCP 56 38482 → 443 [ACK] Seq=1595 Ack=71394 Win=65535 Len=0
  118 1.347245758 192.168.108.128 → 140.82.121.3 TCP 56 38482 → 443 [ACK] Seq=1595 Ack=72482 Win=65535 Len=0
  119 1.364122385 185.199.109.154 → 192.168.108.128 TCP 62 443 → 41970 [SYN, ACK] Seq=0 Ack=1 Win=64240 Len=0 MSS=1460
  120 1.364181728 192.168.108.128 → 185.199.109.154 TCP 56 41970 → 443 [ACK] Seq=1 Ack=1 Win=64240 Len=0
  121 1.366732610 192.168.108.128 → 185.199.109.154 TLSv1.2 647 Client Hello (SNI=github.githubassets.com)
  122 1.367022228 185.199.109.154 → 192.168.108.128 TCP 62 443 → 41970 [ACK] Seq=1 Ack=592 Win=64240 Len=0
  123 1.368027803 185.199.109.154 → 192.168.108.128 TLSv1.3 493 Server Hello, Change Cipher Spec, Application Data, Application Data, Application Data
  124 1.368051578 192.168.108.128 → 185.199.109.154 TCP 56 41968 → 443 [ACK] Seq=592 Ack=438 Win=63803 Len=0
  125 1.368784394 192.168.108.128 → 185.199.109.154 TLSv1.3 120 Change Cipher Spec, Application Data
  126 1.369026052 185.199.109.154 → 192.168.108.128 TCP 62 443 → 41968 [ACK] Seq=438 Ack=656 Win=64240 Len=0
  127 1.370337626 192.168.108.128 → 185.199.109.154 TLSv1.3 226 Application Data
  128 1.370450420 192.168.108.128 → 185.199.109.154 TLSv1.3 367 Application Data
  129 1.370501607 185.199.109.154 → 192.168.108.128 TCP 62 443 → 41968 [ACK] Seq=438 Ack=826 Win=64240 Len=0
  130 1.370537445 185.199.109.154 → 192.168.108.128 TCP 62 443 → 41968 [ACK] Seq=438 Ack=1137 Win=64240 Len=0
  131 1.370689894 192.168.108.128 → 185.199.109.154 TLSv1.3 204 Application Data
  132 1.370837214 185.199.109.154 → 192.168.108.128 TCP 62 443 → 41968 [ACK] Seq=438 Ack=1285 Win=64240 Len=0
  133 1.370924129 192.168.108.128 → 185.199.109.154 TLSv1.3 209 Application Data
  134 1.371044827 185.199.109.154 → 192.168.108.128 TCP 62 443 → 41968 [ACK] Seq=438 Ack=1438 Win=64240 Len=0
  135 1.371072951 192.168.108.128 → 185.199.109.154 TLSv1.3 171 Application Data
  136 1.371156008 185.199.109.154 → 192.168.108.128 TCP 62 443 → 41968 [ACK] Seq=438 Ack=1553 Win=64240 Len=0
  137 1.371237612 192.168.108.128 → 185.199.109.154 TLSv1.3 209 Application Data
  138 1.371340557 185.199.109.154 → 192.168.108.128 TCP 62 443 → 41968 [ACK] Seq=438 Ack=1706 Win=64240 Len=0
  139 1.371426529 192.168.108.128 → 185.199.109.154 TLSv1.3 209 Application Data
  140 1.371531900 185.199.109.154 → 192.168.108.128 TCP 62 443 → 41968 [ACK] Seq=438 Ack=1859 Win=64240 Len=0
  141 1.371608405 192.168.108.128 → 185.199.109.154 TLSv1.3 145 Application Data
  142 1.371701902 185.199.109.154 → 192.168.108.128 TCP 62 443 → 41968 [ACK] Seq=438 Ack=1948 Win=64240 Len=0
  143 1.371760924 192.168.108.128 → 185.199.109.154 TLSv1.3 210 Application Data
  144 1.371876823 192.168.108.128 → 185.199.109.154 TLSv1.3 208 Application Data
  145 1.371967565 185.199.109.154 → 192.168.108.128 TCP 62 443 → 41968 [ACK] Seq=438 Ack=2102 Win=64240 Len=0
  146 1.372019694 185.199.109.154 → 192.168.108.128 TCP 62 443 → 41968 [ACK] Seq=438 Ack=2254 Win=64240 Len=0
  147 1.372048018 192.168.108.128 → 185.199.109.154 TLSv1.3 147 Application Data
  148 1.372135423 185.199.109.154 → 192.168.108.128 TCP 62 443 → 41968 [ACK] Seq=438 Ack=2345 Win=64240 Len=0
  149 1.372227047 192.168.108.128 → 185.199.109.154 TLSv1.3 203 Application Data
  150 1.372304382 185.199.109.154 → 192.168.108.128 TCP 62 443 → 41968 [ACK] Seq=438 Ack=2492 Win=64240 Len=0
  151 1.372398941 192.168.108.128 → 185.199.109.154 TLSv1.3 150 Application Data
  152 1.372525070 185.199.109.154 → 192.168.108.128 TCP 62 443 → 41968 [ACK] Seq=438 Ack=2586 Win=64240 Len=0
  153 1.372923645 192.168.108.128 → 185.199.109.154 TLSv1.3 149 Application Data
  154 1.373113745 185.199.109.154 → 192.168.108.128 TCP 62 443 → 41968 [ACK] Seq=438 Ack=2679 Win=64240 Len=0
  155 1.373262006 192.168.108.128 → 185.199.109.154 TLSv1.3 210 Application Data
  156 1.373381452 185.199.109.154 → 192.168.108.128 TCP 62 443 → 41968 [ACK] Seq=438 Ack=2833 Win=64240 Len=0
  157 1.379815188 192.168.108.128 → 185.199.109.154 TLSv1.3 183 Application Data
  158 1.380224754 185.199.109.154 → 192.168.108.128 TCP 62 443 → 41968 [ACK] Seq=438 Ack=2960 Win=64240 Len=0
  159 1.380269248 192.168.108.128 → 185.199.109.154 TLSv1.3 209 Application Data
  160 1.380414864 185.199.109.154 → 192.168.108.128 TCP 62 443 → 41968 [ACK] Seq=438 Ack=3113 Win=64240 Len=0
  161 1.380495767 192.168.108.128 → 185.199.109.154 TLSv1.3 147 Application Data
  162 1.380635312 185.199.109.154 → 192.168.108.128 TCP 62 443 → 41968 [ACK] Seq=438 Ack=3204 Win=64240 Len=0
  163 1.380711937 192.168.108.128 → 185.199.109.154 TLSv1.3 142 Application Data
  164 1.380825742 185.199.109.154 → 192.168.108.128 TCP 62 443 → 41968 [ACK] Seq=438 Ack=3290 Win=64240 Len=0
  165 1.380903600 192.168.108.128 → 185.199.109.154 TLSv1.3 178 Application Data
  166 1.381045659 192.168.108.128 → 185.199.109.154 TLSv1.3 146 Application Data
  167 1.381550846 185.199.109.154 → 192.168.108.128 TCP 62 443 → 41968 [ACK] Seq=438 Ack=3412 Win=64240 Len=0
  168 1.381550986 185.199.109.154 → 192.168.108.128 TCP 62 443 → 41968 [ACK] Seq=438 Ack=3502 Win=64240 Len=0
  169 1.385242458 192.168.108.128 → 185.199.109.154 TLSv1.3 210 Application Data
  170 1.385502881 185.199.109.154 → 192.168.108.128 TCP 62 443 → 41968 [ACK] Seq=438 Ack=3656 Win=64240 Len=0
  171 1.385593042 192.168.108.128 → 185.199.109.154 TLSv1.3 210 Application Data
  172 1.385696257 185.199.109.154 → 192.168.108.128 TCP 62 443 → 41968 [ACK] Seq=438 Ack=3810 Win=64240 Len=0
  173 1.385766801 192.168.108.128 → 185.199.109.154 TLSv1.3 146 Application Data
  174 1.385870868 185.199.109.154 → 192.168.108.128 TCP 62 443 → 41968 [ACK] Seq=438 Ack=3900 Win=64240 Len=0
  175 1.385947573 192.168.108.128 → 185.199.109.154 TLSv1.3 179 Application Data
  176 1.386051771 185.199.109.154 → 192.168.108.128 TCP 62 443 → 41968 [ACK] Seq=438 Ack=4023 Win=64240 Len=0
  177 1.386116834 192.168.108.128 → 185.199.109.154 TLSv1.3 209 Application Data
  178 1.386212355 185.199.109.154 → 192.168.108.128 TCP 62 443 → 41968 [ACK] Seq=438 Ack=4176 Win=64240 Len=0
  179 1.386283750 192.168.108.128 → 185.199.109.154 TLSv1.3 211 Application Data
  180 1.386390403 185.199.109.154 → 192.168.108.128 TCP 62 443 → 41968 [ACK] Seq=438 Ack=4331 Win=64240 Len=0
  181 1.386750164 192.168.108.128 → 185.199.109.154 TLSv1.3 210 Application Data
  182 1.386864040 185.199.109.154 → 192.168.108.128 TCP 62 443 → 41968 [ACK] Seq=438 Ack=4485 Win=64240 Len=0
  183 1.386912482 192.168.108.128 → 185.199.109.154 TLSv1.3 210 Application Data
  184 1.387011169 185.199.109.154 → 192.168.108.128 TCP 62 443 → 41968 [ACK] Seq=438 Ack=4639 Win=64240 Len=0
  185 1.387069279 192.168.108.128 → 185.199.109.154 TLSv1.3 168 Application Data
  186 1.387190849 192.168.108.128 → 185.199.109.154 TLSv1.3 144 Application Data
  187 1.387349630 185.199.109.154 → 192.168.108.128 TCP 62 443 → 41968 [ACK] Seq=438 Ack=4751 Win=64240 Len=0
  188 1.387349770 185.199.109.154 → 192.168.108.128 TCP 62 443 → 41968 [ACK] Seq=438 Ack=4839 Win=64240 Len=0
  189 1.387436624 192.168.108.128 → 185.199.109.154 TLSv1.3 210 Application Data
  190 1.387525423 185.199.109.154 → 192.168.108.128 TCP 62 443 → 41968 [ACK] Seq=438 Ack=4993 Win=64240 Len=0
  191 1.387596708 192.168.108.128 → 185.199.109.154 TLSv1.3 165 Application Data
  192 1.387715342 185.199.109.154 → 192.168.108.128 TCP 62 443 → 41968 [ACK] Seq=438 Ack=5102 Win=64240 Len=0
  193 1.387747413 192.168.108.128 → 185.199.109.154 TLSv1.3 143 Application Data
  194 1.387862451 185.199.109.154 → 192.168.108.128 TCP 62 443 → 41968 [ACK] Seq=438 Ack=5189 Win=64240 Len=0
  195 1.388055737 192.168.108.128 → 185.199.109.154 TLSv1.3 144 Application Data
  196 1.388161878 185.199.109.154 → 192.168.108.128 TCP 62 443 → 41968 [ACK] Seq=438 Ack=5277 Win=64240 Len=0
  197 1.388220338 192.168.108.128 → 185.199.109.154 TLSv1.3 144 Application Data
  198 1.388322563 185.199.109.154 → 192.168.108.128 TCP 62 443 → 41968 [ACK] Seq=438 Ack=5365 Win=64240 Len=0
  199 1.388404989 192.168.108.128 → 185.199.109.154 TLSv1.3 142 Application Data
  200 1.388504227 185.199.109.154 → 192.168.108.128 TCP 62 443 → 41968 [ACK] Seq=438 Ack=5451 Win=64240 Len=0
  201 1.388582365 192.168.108.128 → 185.199.109.154 TLSv1.3 210 Application Data
  202 1.388681693 185.199.109.154 → 192.168.108.128 TCP 62 443 → 41968 [ACK] Seq=438 Ack=5605 Win=64240 Len=0
  203 1.388726327 192.168.108.128 → 185.199.109.154 TLSv1.3 143 Application Data
  204 1.388819865 185.199.109.154 → 192.168.108.128 TCP 62 443 → 41968 [ACK] Seq=438 Ack=5692 Win=64240 Len=0
  205 1.388875610 192.168.108.128 → 185.199.109.154 TLSv1.3 142 Application Data
  206 1.388973295 185.199.109.154 → 192.168.108.128 TCP 62 443 → 41968 [ACK] Seq=438 Ack=5778 Win=64240 Len=0
  207 1.389024011 192.168.108.128 → 185.199.109.154 TLSv1.3 146 Application Data
  208 1.389123309 185.199.109.154 → 192.168.108.128 TCP 62 443 → 41968 [ACK] Seq=438 Ack=5868 Win=64240 Len=0
  209 1.389168004 192.168.108.128 → 185.199.109.154 TLSv1.3 208 Application Data
  210 1.389249178 185.199.109.154 → 192.168.108.128 TCP 62 443 → 41968 [ACK] Seq=438 Ack=6020 Win=64240 Len=0
  211 1.406587960 185.199.111.133 → 192.168.108.128 TCP 62 443 → 44956 [SYN, ACK] Seq=0 Ack=1 Win=64240 Len=0 MSS=1460
  212 1.406626163 192.168.108.128 → 185.199.111.133 TCP 56 44956 → 443 [ACK] Seq=1 Ack=1 Win=64240 Len=0
  213 1.420307105 192.168.108.128 → 185.199.111.133 TLSv1.2 653 Client Hello (SNI=avatars.githubusercontent.com)
  214 1.420818393 185.199.111.133 → 192.168.108.128 TCP 62 443 → 44956 [ACK] Seq=1 Ack=598 Win=64240 Len=0
  215 1.457316215 185.199.109.154 → 192.168.108.128 TLSv1.3 493 Server Hello, Change Cipher Spec, Application Data, Application Data, Application Data
  216 1.457316916 185.199.109.154 → 192.168.108.128 TLSv1.3 9215 Application Data, Application Data, Application Data, Application Data, Application Data, Application Data, Application Data, Application Data
  217 1.457390115 192.168.108.128 → 185.199.109.154 TCP 56 41970 → 443 [ACK] Seq=592 Ack=438 Win=63803 Len=0
  218 1.457695163 185.199.109.154 → 192.168.108.128 TLSv1.3 1356 Application Data
  219 1.458089479 192.168.108.128 → 185.199.109.154 TCP 56 41968 → 443 [ACK] Seq=6020 Ack=10897 Win=56940 Len=0
  220 1.458223623 192.168.108.128 → 185.199.109.154 TLSv1.3 87 Application Data
  221 1.458362667 185.199.109.154 → 192.168.108.128 TCP 62 443 → 41968 [ACK] Seq=10897 Ack=6051 Win=64240 Len=0
  222 1.459708798 192.168.108.128 → 185.199.109.154 TLSv1.3 120 Change Cipher Spec, Application Data
  223 1.459751407 185.199.109.154 → 192.168.108.128 TLSv1.3 2656 Application Data, Application Data
  224 1.459768400 192.168.108.128 → 185.199.109.154 TCP 56 41968 → 443 [ACK] Seq=6051 Ack=13497 Win=62780 Len=0
  225 1.459850615 185.199.109.154 → 192.168.108.128 TCP 62 443 → 41970 [ACK] Seq=438 Ack=656 Win=64240 Len=0
  226 1.460702649 185.199.109.154 → 192.168.108.128 TLSv1.3 2656 Application Data, Application Data
  227 1.462994981 192.168.108.128 → 185.199.109.154 TCP 56 41968 → 443 [ACK] Seq=6051 Ack=16097 Win=61320 Len=0
  228 1.463422962 192.168.108.128 → 185.199.109.154 TLSv1.3 226 Application Data
  229 1.463579318 185.199.109.154 → 192.168.108.128 TCP 62 443 → 41970 [ACK] Seq=438 Ack=826 Win=64240 Len=0
  230 1.463769839 192.168.108.128 → 185.199.109.154 TLSv1.3 354 Application Data
  231 1.463910034 185.199.109.154 → 192.168.108.128 TCP 62 443 → 41970 [ACK] Seq=438 Ack=1124 Win=64240 Len=0
  232 1.464160509 192.168.108.128 → 185.199.109.154 TLSv1.3 152 Application Data
  233 1.464274866 185.199.109.154 → 192.168.108.128 TCP 62 443 → 41970 [ACK] Seq=438 Ack=1220 Win=64240 Len=0
  234 1.464660626 192.168.108.128 → 185.199.109.154 TLSv1.3 149 Application Data
  235 1.464863460 185.199.109.154 → 192.168.108.128 TCP 62 443 → 41970 [ACK] Seq=438 Ack=1313 Win=64240 Len=0
  236 1.465529361 192.168.108.128 → 185.199.109.154 TLSv1.3 154 Application Data
  237 1.465677903 185.199.109.154 → 192.168.108.128 TCP 62 443 → 41970 [ACK] Seq=438 Ack=1411 Win=64240 Len=0
  238 1.465746934 192.168.108.128 → 185.199.109.154 TLSv1.3 166 Application Data
  239 1.465829771 185.199.109.154 → 192.168.108.128 TCP 62 443 → 41970 [ACK] Seq=438 Ack=1521 Win=64240 Len=0
  240 1.467174117 185.199.109.154 → 192.168.108.128 TLSv1.3 5256 Application Data, Application Data, Application Data, Application Data
  241 1.467203773 192.168.108.128 → 185.199.109.154 TCP 56 41968 → 443 [ACK] Seq=6051 Ack=21297 Win=61320 Len=0
  242 1.472448628 185.199.109.154 → 192.168.108.128 TLSv1.3 2656 Application Data, Application Data
  243 1.472449089 185.199.109.154 → 192.168.108.128 TLSv1.3 2656 Application Data, Application Data
  244 1.477414995 192.168.108.128 → 185.199.109.154 TCP 56 41968 → 443 [ACK] Seq=6051 Ack=26497 Win=56940 Len=0
  245 1.479682920 185.199.109.154 → 192.168.108.128 TLSv1.3 3956 Application Data, Application Data, Application Data
  246 1.479683381 185.199.109.154 → 192.168.108.128 TLSv1.3 1356 Application Data
  247 1.489655490 192.168.108.128 → 185.199.109.154 TCP 56 41968 → 443 [ACK] Seq=6051 Ack=31697 Win=52560 Len=0
  248 1.508667001 185.199.109.154 → 192.168.108.128 TLSv1.3 3956 Application Data, Application Data, Application Data
  249 1.508714601 192.168.108.128 → 185.199.109.154 TCP 56 41968 → 443 [ACK] Seq=6051 Ack=35597 Win=61320 Len=0
  250 1.508956860 185.199.109.154 → 192.168.108.128 TLSv1.3 2656 Application Data, Application Data
  251 1.509002575 192.168.108.128 → 185.199.109.154 TCP 56 41968 → 443 [ACK] Seq=6051 Ack=38197 Win=59860 Len=0
  252 1.509389930 185.199.111.133 → 192.168.108.128 TLSv1.3 493 Server Hello, Change Cipher Spec, Application Data, Application Data, Application Data
  253 1.509405600 192.168.108.128 → 185.199.111.133 TCP 56 44956 → 443 [ACK] Seq=598 Ack=438 Win=63803 Len=0
  254 1.510179445 192.168.108.128 → 185.199.111.133 TLSv1.3 120 Change Cipher Spec, Application Data
  255 1.510561008 185.199.111.133 → 192.168.108.128 TCP 62 443 → 44956 [ACK] Seq=438 Ack=662 Win=64240 Len=0
  256 1.511961309 192.168.108.128 → 185.199.111.133 TLSv1.3 226 Application Data
  257 1.512213899 185.199.111.133 → 192.168.108.128 TCP 62 443 → 44956 [ACK] Seq=438 Ack=832 Win=64240 Len=0
  258 1.512267970 192.168.108.128 → 185.199.111.133 TLSv1.3 344 Application Data
  259 1.512410551 185.199.111.133 → 192.168.108.128 TCP 62 443 → 44956 [ACK] Seq=438 Ack=1120 Win=64240 Len=0
  260 1.522899238 185.199.109.154 → 192.168.108.128 TLSv1.3 3956 Application Data, Application Data, Application Data
  261 1.522934605 192.168.108.128 → 185.199.109.154 TCP 56 41968 → 443 [ACK] Seq=6051 Ack=42097 Win=61320 Len=0
  262 1.611445986 185.199.109.154 → 192.168.108.128 TLSv1.3 3956 Application Data, Application Data, Application Data
  263 1.611550635 192.168.108.128 → 185.199.109.154 TCP 56 41968 → 443 [ACK] Seq=6051 Ack=45997 Win=61320 Len=0
  264 1.611632089 185.199.109.154 → 192.168.108.128 TLSv1.3 2656 Application Data, Application Data
  265 1.611632139 185.199.109.154 → 192.168.108.128 TLSv1.3 2656 Application Data, Application Data
  266 1.612173664 185.199.109.154 → 192.168.108.128 TLSv1.3 5256 Application Data, Application Data, Application Data, Application Data
  267 1.612440249 185.199.109.154 → 192.168.108.128 TLSv1.3 5256 Application Data, Application Data, Application Data, Application Data
  268 1.612497627 192.168.108.128 → 185.199.109.154 TCP 56 41968 → 443 [ACK] Seq=6051 Ack=61597 Win=49640 Len=0
  269 1.612864382 185.199.109.154 → 192.168.108.128 TLSv1.3 13056 Application Data, Application Data, Application Data
  270 1.613282203 185.199.109.154 → 192.168.108.128 TCP 2656 443 → 41968 [PSH, ACK] Seq=74597 Ack=6051 Win=64240 Len=2600
  271 1.613417910 192.168.108.128 → 185.199.109.154 TCP 56 41968 → 443 [ACK] Seq=6051 Ack=77197 Win=62780 Len=0
  272 1.613561042 185.199.109.154 → 192.168.108.128 TLSv1.3 7856 Application Data
  273 1.613577974 192.168.108.128 → 185.199.109.154 TCP 56 41968 → 443 [ACK] Seq=6051 Ack=84997 Win=65535 Len=0
  274 1.613645481 185.199.109.154 → 192.168.108.128 TCP 3956 443 → 41968 [PSH, ACK] Seq=84997 Ack=6051 Win=64240 Len=3900
  275 1.613652705 192.168.108.128 → 185.199.109.154 TCP 56 41968 → 443 [ACK] Seq=6051 Ack=88897 Win=65535 Len=0
  276 1.614278069 185.199.109.154 → 192.168.108.128 TCP 3956 443 → 41968 [PSH, ACK] Seq=88897 Ack=6051 Win=64240 Len=3900
  277 1.614298498 192.168.108.128 → 185.199.109.154 TCP 56 41968 → 443 [ACK] Seq=6051 Ack=92797 Win=65535 Len=0
  278 1.614555936 185.199.109.154 → 192.168.108.128 TCP 3956 443 → 41968 [PSH, ACK] Seq=92797 Ack=6051 Win=64240 Len=3900
  279 1.614569622 192.168.108.128 → 185.199.109.154 TCP 56 41968 → 443 [ACK] Seq=6051 Ack=96697 Win=65535 Len=0
  280 1.614707573 185.199.109.154 → 192.168.108.128 TLSv1.3 3956 Application Data
  281 1.614718724 192.168.108.128 → 185.199.109.154 TCP 56 41968 → 443 [ACK] Seq=6051 Ack=100597 Win=65535 Len=0
  282 1.614810227 185.199.109.154 → 192.168.108.128 TCP 2976 443 → 41968 [ACK] Seq=100597 Ack=6051 Win=64240 Len=2920
  283 1.614818523 192.168.108.128 → 185.199.109.154 TCP 56 41968 → 443 [ACK] Seq=6051 Ack=103517 Win=65535 Len=0
  284 1.614903524 185.199.109.154 → 192.168.108.128 TCP 4936 443 → 41968 [PSH, ACK] Seq=103517 Ack=6051 Win=64240 Len=4880
  285 1.614911800 192.168.108.128 → 185.199.109.154 TCP 56 41968 → 443 [ACK] Seq=6051 Ack=108397 Win=65535 Len=0
  286 1.615041205 185.199.109.154 → 192.168.108.128 TCP 1356 443 → 41968 [PSH, ACK] Seq=108397 Ack=6051 Win=64240 Len=1300
  287 1.615052917 192.168.108.128 → 185.199.109.154 TCP 56 41968 → 443 [ACK] Seq=6051 Ack=109697 Win=65535 Len=0
  288 1.616809524 185.199.109.154 → 192.168.108.128 TCP 3956 443 → 41968 [PSH, ACK] Seq=109697 Ack=6051 Win=64240 Len=3900
  289 1.616886500 192.168.108.128 → 185.199.109.154 TCP 56 41968 → 443 [ACK] Seq=6051 Ack=113597 Win=65535 Len=0
  290 1.616998683 185.199.109.154 → 192.168.108.128 TLSv1.3 1356 Application Data
  291 1.617010054 192.168.108.128 → 185.199.109.154 TCP 56 41968 → 443 [ACK] Seq=6051 Ack=114897 Win=65535 Len=0
  292 1.617342414 185.199.109.154 → 192.168.108.128 TCP 5256 443 → 41968 [PSH, ACK] Seq=114897 Ack=6051 Win=64240 Len=5200
  293 1.617342654 185.199.109.154 → 192.168.108.128 TCP 1356 443 → 41968 [PSH, ACK] Seq=120097 Ack=6051 Win=64240 Len=1300
  294 1.617355158 192.168.108.128 → 185.199.109.154 TCP 56 41968 → 443 [ACK] Seq=6051 Ack=120097 Win=65535 Len=0
  295 1.617400514 192.168.108.128 → 185.199.109.154 TCP 56 41968 → 443 [ACK] Seq=6051 Ack=121397 Win=65535 Len=0
  296 1.617648954 185.199.109.154 → 192.168.108.128 TCP 2656 443 → 41968 [PSH, ACK] Seq=121397 Ack=6051 Win=64240 Len=2600
  297 1.617664734 192.168.108.128 → 185.199.109.154 TCP 56 41968 → 443 [ACK] Seq=6051 Ack=123997 Win=65535 Len=0
  298 1.689587675 185.199.109.154 → 192.168.108.128 TCP 1356 443 → 41968 [PSH, ACK] Seq=123997 Ack=6051 Win=64240 Len=1300
  299 1.689715427 192.168.108.128 → 185.199.109.154 TCP 56 41968 → 443 [ACK] Seq=6051 Ack=125297 Win=65535 Len=0
  300 1.702897876 185.199.109.154 → 192.168.108.128 TCP 2656 443 → 41968 [PSH, ACK] Seq=125297 Ack=6051 Win=64240 Len=2600
  301 1.702898347 185.199.109.154 → 192.168.108.128 TLSv1.3 6556 Application Data
  302 1.702898387 185.199.109.154 → 192.168.108.128 TCP 2656 443 → 41968 [PSH, ACK] Seq=134397 Ack=6051 Win=64240 Len=2600
  303 1.702935648 192.168.108.128 → 185.199.109.154 TCP 56 41968 → 443 [ACK] Seq=6051 Ack=127897 Win=65535 Len=0
  304 1.703037160 192.168.108.128 → 185.199.109.154 TCP 56 41968 → 443 [ACK] Seq=6051 Ack=134397 Win=65535 Len=0
  305 1.703070203 192.168.108.128 → 185.199.109.154 TCP 56 41968 → 443 [ACK] Seq=6051 Ack=136997 Win=65535 Len=0
  306 1.703106221 185.199.109.154 → 192.168.108.128 TCP 2656 443 → 41968 [PSH, ACK] Seq=136997 Ack=6051 Win=64240 Len=2600
  307 1.703115669 192.168.108.128 → 185.199.109.154 TCP 56 41968 → 443 [ACK] Seq=6051 Ack=139597 Win=65535 Len=0
  308 1.703173528 185.199.109.154 → 192.168.108.128 TCP 1356 443 → 41968 [PSH, ACK] Seq=139597 Ack=6051 Win=64240 Len=1300
  309 1.703180301 192.168.108.128 → 185.199.109.154 TCP 56 41968 → 443 [ACK] Seq=6051 Ack=140897 Win=65535 Len=0
  310 1.703656864 185.199.109.154 → 192.168.108.128 TCP 2656 443 → 41968 [PSH, ACK] Seq=140897 Ack=6051 Win=64240 Len=2600
  311 1.703688644 192.168.108.128 → 185.199.109.154 TCP 56 41968 → 443 [ACK] Seq=6051 Ack=143497 Win=65535 Len=0
  312 1.703777792 185.199.109.154 → 192.168.108.128 TCP 1356 443 → 41968 [PSH, ACK] Seq=143497 Ack=6051 Win=64240 Len=1300
  313 1.703777973 185.199.109.154 → 192.168.108.128 TLSv1.3 4015 Application Data, Application Data, Application Data, Application Data
  314 1.703789835 192.168.108.128 → 185.199.109.154 TCP 56 41968 → 443 [ACK] Seq=6051 Ack=144797 Win=65535 Len=0
  315 1.703816516 192.168.108.128 → 185.199.109.154 TCP 56 41970 → 443 [ACK] Seq=1521 Ack=4397 Win=61320 Len=0
  316 1.704072791 185.199.109.154 → 192.168.108.128 TLSv1.3 3591 Application Data, Application Data, Application Data
  317 1.704072931 185.199.109.154 → 192.168.108.128 TLSv1.3 2656 Application Data, Application Data
  318 1.704073012 185.199.109.154 → 192.168.108.128 TCP 2656 443 → 41968 [PSH, ACK] Seq=144797 Ack=6051 Win=64240 Len=2600
  319 1.704088260 192.168.108.128 → 185.199.109.154 TCP 56 41970 → 443 [ACK] Seq=1521 Ack=7932 Win=58400 Len=0
  320 1.704117346 192.168.108.128 → 185.199.109.154 TCP 56 41970 → 443 [ACK] Seq=1521 Ack=10532 Win=56940 Len=0
  321 1.704154335 192.168.108.128 → 185.199.109.154 TCP 56 41968 → 443 [ACK] Seq=6051 Ack=147397 Win=65535 Len=0
  322 1.704329507 192.168.108.128 → 185.199.109.154 TLSv1.3 87 Application Data
  323 1.704446028 185.199.109.154 → 192.168.108.128 TCP 62 443 → 41970 [ACK] Seq=10532 Ack=1552 Win=64240 Len=0
  324 1.704480363 185.199.109.154 → 192.168.108.128 TLSv1.3 2656 Application Data
  325 1.704486595 192.168.108.128 → 185.199.109.154 TCP 56 41968 → 443 [ACK] Seq=6051 Ack=149997 Win=65535 Len=0
  326 1.705034393 185.199.111.133 → 192.168.108.128 TLSv1.3 2157 Application Data, Application Data, Application Data
  327 1.705034613 185.199.109.154 → 192.168.108.128 TLSv1.3 1356 Application Data
  328 1.705034663 185.199.109.154 → 192.168.108.128 TCP 1356 443 → 41968 [PSH, ACK] Seq=149997 Ack=6051 Win=64240 Len=1300
  329 1.705034693 185.199.109.154 → 192.168.108.128 TCP 1356 443 → 41968 [PSH, ACK] Seq=151297 Ack=6051 Win=64240 Len=1300
  330 1.705034733 185.199.109.154 → 192.168.108.128 TLSv1.3 1356 Application Data
  331 1.705034773 185.199.109.154 → 192.168.108.128 TCP 2656 443 → 41968 [PSH, ACK] Seq=152597 Ack=6051 Win=64240 Len=2600
  332 1.705054912 192.168.108.128 → 185.199.111.133 TCP 56 44956 → 443 [ACK] Seq=1120 Ack=2539 Win=62780 Len=0
  333 1.705091300 192.168.108.128 → 185.199.109.154 TCP 56 41970 → 443 [ACK] Seq=1552 Ack=11832 Win=55640 Len=0
  334 1.705117189 192.168.108.128 → 185.199.109.154 TCP 56 41968 → 443 [ACK] Seq=6051 Ack=151297 Win=65535 Len=0
  335 1.705139371 192.168.108.128 → 185.199.109.154 TCP 56 41968 → 443 [ACK] Seq=6051 Ack=152597 Win=65535 Len=0
  336 1.705181872 192.168.108.128 → 185.199.109.154 TCP 56 41970 → 443 [ACK] Seq=1552 Ack=13132 Win=55640 Len=0
  337 1.705205727 192.168.108.128 → 185.199.109.154 TCP 56 41968 → 443 [ACK] Seq=6051 Ack=155197 Win=65535 Len=0
  338 1.705261934 185.199.109.154 → 192.168.108.128 TCP 1516 443 → 41968 [ACK] Seq=155197 Ack=6051 Win=64240 Len=1460
  339 1.705269728 192.168.108.128 → 185.199.109.154 TCP 56 41968 → 443 [ACK] Seq=6051 Ack=156657 Win=65535 Len=0
  340 1.705315966 185.199.109.154 → 192.168.108.128 TCP 1196 443 → 41968 [PSH, ACK] Seq=156657 Ack=6051 Win=64240 Len=1140
  341 1.705320925 192.168.108.128 → 185.199.109.154 TCP 56 41968 → 443 [ACK] Seq=6051 Ack=157797 Win=65535 Len=0
  342 1.705583082 185.199.109.154 → 192.168.108.128 TLSv1.3 2656 Application Data, Application Data
  343 1.705583252 185.199.109.154 → 192.168.108.128 TCP 1356 443 → 41968 [PSH, ACK] Seq=157797 Ack=6051 Win=64240 Len=1300
  344 1.705622296 192.168.108.128 → 185.199.109.154 TCP 56 41970 → 443 [ACK] Seq=1552 Ack=15732 Win=53040 Len=0
  345 1.705652554 192.168.108.128 → 185.199.109.154 TCP 56 41968 → 443 [ACK] Seq=6051 Ack=159097 Win=65535 Len=0
  346 1.706660452 192.168.108.128 → 185.199.111.133 TLSv1.3 87 Application Data
  347 1.706698104 185.199.109.154 → 192.168.108.128 TCP 2656 443 → 41968 [PSH, ACK] Seq=159097 Ack=6051 Win=64240 Len=2600
  348 1.706698304 185.199.109.154 → 192.168.108.128 TLSv1.3 2656 Application Data
  349 1.706833320 192.168.108.128 → 185.199.109.154 TCP 56 41968 → 443 [ACK] Seq=6051 Ack=161697 Win=65535 Len=0
  350 1.706839571 192.168.108.128 → 185.199.109.154 TCP 56 41968 → 443 [ACK] Seq=6051 Ack=164297 Win=65535 Len=0
  351 1.706842708 185.199.109.154 → 192.168.108.128 TCP 1356 443 → 41968 [PSH, ACK] Seq=164297 Ack=6051 Win=64240 Len=1300
  352 1.706842848 185.199.109.154 → 192.168.108.128 TLSv1.3 1356 Application Data
  353 1.706962344 192.168.108.128 → 185.199.109.154 TCP 56 41968 → 443 [ACK] Seq=6051 Ack=165597 Win=65535 Len=0
  354 1.706971171 192.168.108.128 → 185.199.109.154 TCP 56 41970 → 443 [ACK] Seq=1552 Ack=17032 Win=62780 Len=0
  355 1.707041635 185.199.111.133 → 192.168.108.128 TCP 62 443 → 44956 [ACK] Seq=2539 Ack=1151 Win=64240 Len=0
  356 1.707041855 185.199.109.154 → 192.168.108.128 TLSv1.3 1356 Application Data
  357 1.707067053 192.168.108.128 → 185.199.109.154 TCP 56 41970 → 443 [ACK] Seq=1552 Ack=18332 Win=62780 Len=0
  358 1.708080943 185.199.109.154 → 192.168.108.128 TCP 2656 443 → 41968 [PSH, ACK] Seq=165597 Ack=6051 Win=64240 Len=2600
  359 1.708102734 192.168.108.128 → 185.199.109.154 TCP 56 41968 → 443 [ACK] Seq=6051 Ack=168197 Win=65535 Len=0
  360 1.708171805 185.199.109.154 → 192.168.108.128 TCP 5256 443 → 41968 [PSH, ACK] Seq=168197 Ack=6051 Win=64240 Len=5200
  361 1.708171895 185.199.109.154 → 192.168.108.128 TLSv1.3 2656 Application Data, Application Data
  362 1.708184229 192.168.108.128 → 185.199.109.154 TCP 56 41968 → 443 [ACK] Seq=6051 Ack=173397 Win=65535 Len=0
  363 1.708209867 192.168.108.128 → 185.199.109.154 TCP 56 41970 → 443 [ACK] Seq=1552 Ack=20932 Win=61320 Len=0
  364 1.708701248 185.199.109.154 → 192.168.108.128 TCP 6556 443 → 41968 [PSH, ACK] Seq=173397 Ack=6051 Win=64240 Len=6500
  365 1.708728880 192.168.108.128 → 185.199.109.154 TCP 56 41968 → 443 [ACK] Seq=6051 Ack=179897 Win=65535 Len=0
  366 1.708958365 185.199.109.154 → 192.168.108.128 TLSv1.3 1356 Application Data
  367 1.708973023 192.168.108.128 → 185.199.109.154 TCP 56 41968 → 443 [ACK] Seq=6051 Ack=181197 Win=65535 Len=0
  368 1.709121784 185.199.109.154 → 192.168.108.128 TLSv1.3 3280 Application Data, Application Data, Application Data
  369 1.709122015 185.199.109.154 → 192.168.108.128 TCP 1356 443 → 41968 [PSH, ACK] Seq=181197 Ack=6051 Win=64240 Len=1300
  370 1.709141963 192.168.108.128 → 185.199.109.154 TCP 56 41970 → 443 [ACK] Seq=1552 Ack=24156 Win=58400 Len=0
  371 1.709195204 192.168.108.128 → 185.199.109.154 TCP 56 41968 → 443 [ACK] Seq=6051 Ack=182497 Win=65535 Len=0
  372 1.709484782 185.199.109.154 → 192.168.108.128 TCP 1356 443 → 41968 [PSH, ACK] Seq=182497 Ack=6051 Win=64240 Len=1300
  373 1.709497096 192.168.108.128 → 185.199.109.154 TCP 56 41968 → 443 [ACK] Seq=6051 Ack=183797 Win=65535 Len=0
  374 1.712942352 185.199.109.154 → 192.168.108.128 TCP 2656 443 → 41968 [PSH, ACK] Seq=183797 Ack=6051 Win=64240 Len=2600
  375 1.713019437 192.168.108.128 → 185.199.109.154 TCP 56 41968 → 443 [ACK] Seq=6051 Ack=186397 Win=65535 Len=0
  376 1.713087646 185.199.109.154 → 192.168.108.128 TLSv1.3 1356 Application Data
